{
  "status": "SUCCESS",
  "figmaScreenSpec": null,
  "issues": [],
  "generatedAt": "2026-08-16T09:40:00Z",
  "screenId": "qna-detail",
  "screenVersion": 3,
  "mode": "MERGE",
  "startedAt": "2026-08-16T09:39:50Z",
  "completedAt": "2026-08-16T09:40:00Z",
  "success": true,
  "reusedInstanceCount": 12,
  "createdInstanceCount": 0,
  "archivedNodeCount": 0,
  "fallbackCount": 0,
  "changes": [{
    "logicalNodeId": "qna-detail/root/action/save",
    "logicalType": "krds.button",
    "changeType": "REUSE",
    "detail": "Published Button Instance 재사용",
    "componentKey": "BUTTON_PRIMARY_KEY"
  }],
  "ssotEvidence": {
    "catalogVersion": "2.0.0",
    "catalogHash": "aaaaaaaaaaaaaaaaaaaaaaaaaaaaaaaaaaaaaaaaaaaaaaaaaaaaaaaaaaaaaaaa",
    "registryVersion": "3.0.0",
    "registryHash": "bbbbbbbbbbbbbbbbbbbbbbbbbbbbbbbbbbbbbbbbbbbbbbbbbbbbbbbbbbbbbbbb"
  },
  "refinement": {
    "patchSetId": "qna-detail-refine-1",
    "patchSetVersion": 1,
    "appliedCount": 2,
    "excludedCount": 0,
    "conflictCount": 1,
    "blockedCount": 1
  }
}
